{
  "@context": "http://qiicr.org/dcmqi/contexts/dcmqi.jsonld",
  "id": "https://raw.githubusercontent.com/qiicr/dcmqi/master/doc/sr-tid1500-schema.json#",
  "$schema": "http://json-schema.org/draft-04/schema#",
  "definitions": {
    "measurementItem": {
      "type": "object",
      "additionalProperties": false,
      "properties": {
        "value": {
          "$ref": "https://raw.githubusercontent.com/qiicr/dcmqi/master/doc/common-schema.json#/definitions/DS"
        },
        "quantity": {
          "$ref": "https://raw.githubusercontent.com/qiicr/dcmqi/master/doc/common-schema.json#/definitions/codeSequence"
        },
        "units": {
          "$ref": "https://raw.githubusercontent.com/qiicr/dcmqi/master/doc/common-schema.json#/definitions/codeSequence"
        },
        "derivationModifier": {
          "$ref": "https://raw.githubusercontent.com/qiicr/dcmqi/master/doc/common-schema.json#/definitions/codeSequence"
        }
      }
    },
    "MeasurementGroup": {
      "type": "object",
      "additionalProperties": false,
      "properties": {
        "TrackingIdentifier": {
          "$ref": "https://raw.githubusercontent.com/qiicr/dcmqi/master/doc/sr-common-schema.json#/definitions/TEXT"
        },
        "TrackingUniqueIdentifier": {
          "$ref": "https://raw.githubusercontent.com/qiicr/dcmqi/master/doc/sr-common-schema.json#/definitions/UIDREF"
        },
        "ReferencedSegment": {
          "type": "number"
        },
        "SourceSeriesForImageSegmentation": {
          "$ref": "https://raw.githubusercontent.com/qiicr/dcmqi/master/doc/sr-common-schema.json#/definitions/UIDREF"
        },
        "segmentationSOPInstanceUID": {
          "$ref": "https://raw.githubusercontent.com/qiicr/dcmqi/master/doc/sr-common-schema.json#/definitions/UIDREF"
        },
        "rwvmMapUsedForMeasurement": {
          "$ref": "https://raw.githubusercontent.com/qiicr/dcmqi/master/doc/sr-common-schema.json#/definitions/UIDREF"
        },
        "MeasurementMethod": {
          "$ref": "https://raw.githubusercontent.com/qiicr/dcmqi/master/doc/common-schema.json#/definitions/codeSequence"
        },
        "Finding": {
          "$ref": "https://raw.githubusercontent.com/qiicr/dcmqi/master/doc/common-schema.json#/definitions/codeSequence"
        },
        "FindingSite": {
          "$ref": "https://raw.githubusercontent.com/qiicr/dcmqi/master/doc/common-schema.json#/definitions/codeSequence"
        },
        "measurementItems": {
          "type": "array",
          "minItems": 1,
          "items": {
            "$ref": "#/definitions/measurementItem"
          }
        }
      }
    },
    "referencedImageFileNames": {
      "type": "array",
      "items": {
        "type": "string"
      }
    }
  },
  "additionalProperties": false,
  "properties": {
    "@schema": {"type" : "string"},
    "compositeContext": {
      "$ref": "https://raw.githubusercontent.com/qiicr/dcmqi/master/doc/common-schema.json#/definitions/dicomInstancesFileNameList"
    },
    "imageLibrary": {
      "$ref": "https://raw.githubusercontent.com/qiicr/dcmqi/master/doc/common-schema.json#/definitions/dicomInstancesFileNameList"
    },
    "observerContext": {
      "$ref": "https://raw.githubusercontent.com/qiicr/dcmqi/master/doc/sr-common-schema.json#/definitions/observerContext"
    },
    "activitySession": {
      "type": "string",
      "default": "1"
    },
    "timePoint": {
      "type": "string",
      "default": "1"
    },
    "VerificationFlag": {
      "allOf": [
        {
          "$ref": "https://raw.githubusercontent.com/qiicr/dcmqi/master/doc/common-schema.json#/definitions/CS"
        },
        {
          "enum": [
            "VERIFIED",
            "UNVERIFIED"
          ]
        },
        {
          "default": "UNVERIFIED"
        }
      ]
    },
    "CompletionFlag": {
      "allOf": [
        {
          "$ref": "https://raw.githubusercontent.com/qiicr/dcmqi/master/doc/common-schema.json#/definitions/CS"
        },
        {
          "enum": [
            "PARTIAL",
            "COMPLETE"
          ]
        },
        {
          "default": "PARTIAL"
        }
      ]
    },
    "SeriesDescription": {
      "$ref": "https://raw.githubusercontent.com/qiicr/dcmqi/master/doc/common-schema.json#/definitions/LO",
      "default": "Measurements"
    },
    "SeriesNumber": {
      "$ref": "https://raw.githubusercontent.com/qiicr/dcmqi/master/doc/common-schema.json#/definitions/IS",
      "default": "400"
    },
    "InstanceNumber": {
      "$ref": "https://raw.githubusercontent.com/qiicr/dcmqi/master/doc/common-schema.json#/definitions/IS",
      "default": "1"
    },
    "Measurements": {
      "type": "array",
      "minItems": 1,
      "items": {
        "$ref": "#/definitions/MeasurementGroup"
      }
    },
    "CodingSchemeIdentificationSequence": {
      "type": "array",
      "items": {
        "$ref": "https://raw.githubusercontent.com/qiicr/dcmqi/master/doc/common-schema.json#/definitions/codingSchemeIdentificationSequenceItem"
      }
    }
  }
}
