{
  "@schema": "https://raw.githubusercontent.com/qiicr/dcmqi/master/doc/sr-tid1500-schema.json#",

  "SeriesDescription": "Measurements",
  "SeriesNumber": "1001",
  "InstanceNumber": "1",

  "compositeContext": [
    "liver.dcm"
  ],

  "imageLibrary": [
    "01.dcm",
    "02.dcm",
    "03.dcm"
  ],

  "observerContext": {
    "ObserverType": "PERSON",
    "PersonObserverName": "Reader1"
  },

  "VerificationFlag": "VERIFIED",
  "CompletionFlag": "COMPLETE",

  "activitySession": "1",
  "timePoint": "1",

  "Measurements": [
    {
      "TrackingIdentifier": "Measurements group 1",
      "ReferencedSegment": 1,
      "SourceSeriesForImageSegmentation": "1.2.392.200103.20080913.113635.1.2009.6.22.21.43.10.23430.1",
      "segmentationSOPInstanceUID": "1.2.276.0.7230010.3.1.4.0.42154.1458337731.665796",
      "Finding": {
        "CodeValue": "T-D0060",
        "CodingSchemeDesignator": "SRT",
        "CodeMeaning": "Organ"
      },
      "FindingSite": {
        "CodeValue": "T-62000",
        "CodingSchemeDesignator": "SRT",
        "CodeMeaning": "Liver"
      },
      "measurementItems": [
        {
          "value": "37.3289",
          "quantity": {
            "CodeValue": "112031",
            "CodingSchemeDesignator": "DCM",
            "CodeMeaning": "Attenuation Coefficient"
          },
          "units": {
            "CodeValue": "[hnsf'U]",
            "CodingSchemeDesignator": "UCUM",
            "CodeMeaning": "Hounsfield unit"
          },
          "derivationModifier": {
            "CodeValue": "R-00317",
            "CodingSchemeDesignator": "SRT",
            "CodeMeaning": "Mean"
          }
        },
        {
          "value": "-778",
          "quantity": {
            "CodeValue": "112031",
            "CodingSchemeDesignator": "DCM",
            "CodeMeaning": "Attenuation Coefficient"
          },
          "units": {
            "CodeValue": "[hnsf'U]",
            "CodingSchemeDesignator": "UCUM",
            "CodeMeaning": "Hounsfield unit"
          },
          "derivationModifier": {
            "CodeValue": "R-404FB",
            "CodingSchemeDesignator": "SRT",
            "CodeMeaning": "Minimum"
          }
        },
        {
          "value": "221",
          "quantity": {
            "CodeValue": "112031",
            "CodingSchemeDesignator": "DCM",
            "CodeMeaning": "Attenuation Coefficient"
          },
          "units": {
            "CodeValue": "[hnsf'U]",
            "CodingSchemeDesignator": "UCUM",
            "CodeMeaning": "Hounsfield unit"
          },
          "derivationModifier": {
            "CodeValue": "G-A437",
            "CodingSchemeDesignator": "SRT",
            "CodeMeaning": "Maximum"
          }
        },
        {
          "value": "59.1691",
          "quantity": {
            "CodeValue": "112031",
            "CodingSchemeDesignator": "DCM",
            "CodeMeaning": "Attenuation Coefficient"
          },
          "units": {
            "CodeValue": "[hnsf'U]",
            "CodingSchemeDesignator": "UCUM",
            "CodeMeaning": "Hounsfield unit"
          },
          "derivationModifier": {
            "CodeValue": "R-10047",
            "CodingSchemeDesignator": "SRT",
            "CodeMeaning": "Standard Deviation"
          }
        },
        {
          "value": "70361.9",
          "quantity": {
            "CodeValue": "G-D705",
            "CodingSchemeDesignator": "SRT",
            "CodeMeaning": "Volume"
          },
          "units": {
            "CodeValue": "mm3",
            "CodingSchemeDesignator": "UCUM",
            "CodeMeaning": "cubic millimeter"
          }
        },
        {
          "value": "70.3619",
          "quantity": {
            "CodeValue": "G-D705",
            "CodingSchemeDesignator": "SRT",
            "CodeMeaning": "Volume"
          },
          "units": {
            "CodeValue": "cm3",
            "CodingSchemeDesignator": "UCUM",
            "CodeMeaning": "cubic centimeter"
          }
        }
      ]
    }
  ]
}
